{
  "formatVersion": 1,
  "id": "3f6c2c9e-6c1a-4f7b-9d2e-1b7a9d5c0e21",
  "modelSHA256": "0123456789abcdef0123456789abcdef0123456789abcdef0123456789abcdef",
  "prompt": "Describe the picture.",
  "backend": "CPU",
  "contextLength": 1024,
  "maxOutputTokens": 32,
  "manifest": {
    "format_version": 1,
    "source_sha256": "fedcba9876543210fedcba9876543210fedcba9876543210fedcba9876543210",
    "tapped_sha256": "89abcdef0123456789abcdef0123456789abcdef0123456789abcdef01234567",
    "taps": [
      {
        "signature": "prefill",
        "subgraph": 0,
        "op": 12,
        "output": 0,
        "tensor": 40,
        "tensor_name": "model/layer_0/output",
        "output_name": "layer0_output",
        "shape": [1, 1, 1536],
        "tensor_type": 0
      }
    ]
  },
  "messages": [
    {"role": "user", "content": [{"type": "text", "text": "Hello"}]},
    {"role": "assistant", "content": [{"type": "text", "text": "Hi."}]}
  ]
}
